question,option_1,option_2,option_3,option_4,correct_answer,category_id,display_date,created_by,updated_by
With which sport is Sachin Tendulkar associated?,Table tennis,Cycling,Hockey,Cricket,4,3,,system,
Which author wrote 'A Game of Thrones'?,Jack Vance,George R. R. Martin,Edgar Rice Burroughs,Stephen King,2,4,,system,
Who was the first president of Mexico?,Benito Juarez,Porfirio Diaz,Guadalupe Victoria,Vicente Fox,3,3,,system,
Which of these quotes is from the film 'All About Eve'?,"""Fasten your seatbelts. It's going to be a bumpy night.""","""I'm as mad as hell, and I'm not going to take this anymore!""","""I'll be back.""","""We'll always have Paris.""",1,4,,system,
Which region of the world uses '.za' at the end of its web addresses?,South Africa,Zimbabwe,Tanzania,Zambia,1,1,,system,
"In the South-Western French commune of Niaux, where would you find the most valuable paintings?",A museum,A palace,A cave,A cathedral,3,3,,system,
"Who played the character Qui-Gon Jinn in the Star Wars movie ""The Phantom Menace""?",Mark Hamill,Harrison Ford,Liam Neeson,Ewan McGregor,3,4,,system,
What is the meaning of the name of the constellation Cygnus?,Mountain,River,Ring,Swan,4,3,,system,
"When visiting Finland, Santa leaves his sleigh behind and rides on what?",Rudolph,A broomstick,A goat,A goose,3,3,,system,
Which director directed Interstellar?,Woody Allen,Steven Spielberg,Christopher Nolan,Martin Scorsese,3,4,,system,
"In an attempt to finance German WWI reparations, which chemist tried to extract gold from seawater?",Marie Curie,Albert Einstein,Robert Boyle,Fritz Haber,4,2,,system,
What US state is nicknamed the Golden State?,Hawaii,California,Alaska,Vermont,2,1,,system,
"Who was the 4th president of the USA, in term during the period 1809–1817?",Zachary Taylor,John Adams,James Madison,Herbert Hoover,3,3,,system,
What body part can geckos snap off and leave behind when in danger?,The tail,The horns,The claws,The legs,1,2,,system,
"Which singer had a 1967 hit with ""You Make Me Feel Like A Natural Woman""?",Patti LaBelle,Gladys Knight,Diana Ross,Aretha Franklin,4,4,,system,
What is Ecology the study of?,"Windmills, watermills and animal engines",The practice of escaping from restraints,The relationships between living organisms and their environment,The death of stars,3,2,,system,
Which Archduchess of Austria became Queen of France in 1774?,Diane de Poitiers,Eleanor of Aquitaine,Marie de' Medici,Marie Antoinette,4,3,,system,
Which element makes up 8.13% of the Earth's crust,Iron,Silicon,Aluminium,Oxygen,3,1,,system,
Which of these countries borders Central African Republic?,Gabon,Rwanda,Equatorial Guinea,Democratic Republic of the Congo,4,1,,system,
On which scale is normal human body temperature approximately 37 degrees?,Fahrenheit,Rankine,Celsius,Kelvin,3,2,,system,
What was Brett's last supper in the film Pulp Fiction?,Big Kahuna burger ,Dunkin' Donuts,Royale With Cheese ,KFC Family Bucket,1,4,,system,
Which piece of written work starts with the line 'There was no possibility of taking a walk that day.'?,Jane Eyre,Little Women,David Copperfield,The Lady of the Camellias,1,4,,system,
What would you call a baby llama?,A Lamb,A Cria,A Baby,An Infant,2,2,,system,
Which Instrument Measures Atmospheric Pressure?,A Meterometer,An Atmoseter,A Barometer ,A Hydrometer,3,2,,system,
Which video game series is sometimes referred to as GTA?,Grind Them All!,Gear to Advance,Go to America,Grand Theft Auto,4,3,,system,
What abbreviation is commonly used to refer to music albums?,CDs,DVDs,LPs,MP3s,3,4,,system,
"Which philosopher famously said 'The life of man (in a state of nature) is solitary, poor, nasty, brutish, and short'?",Friedrich Nietzsche,Thomas Hobbes,Bertrand Russell,Ludwig Wittgenstein,2,3,,system,
Which brand is associated with the marketing slogan 'The happiest place on earth'?,Disneyland,Hallmark,Airbnb,Holiday Inn,1,3,,system,
In which book does 'Charles Stewart Parnell' appear?,A Portrait of the Artist as a Young Man,David Copperfield,Little Women,Jane Eyre,1,4,,system,
Which Greek god took Persephone to be his queen in the underworld after she ate his pomegranate seeds?,Poseidon,Zeus,Apollo,Hades,4,3,,system,
Which marketing slogan would you associate with L'Oreal?,It's Style,Maybe she's born with it,Quality never goes out of style,Because you're worth it,4,3,,system,
How many holes are there on a traditional paint pallette?,0,1,3,2,2,4,,system,
Where would you find the city of Doha?,Bahrain,Lebanon,Egypt,Qatar,4,1,,system,
What is the word for a group of goldfinches?,A paddling,A charm,A bevy,A flight,2,2,,system,
What is the word for a group of peacocks?,A run,A muster,A pace,A flight,2,2,,system,
"Which musician had a hit in 1967 with ""Kentucky Woman""?",Neil Diamond,Elton John,The Beatles,The Rolling Stones,1,4,,system,
"In the nursery rhyme Baa Baa Black Sheep, how many bags of wool does the sheep have?",2,3,1,4,2,3,,system,
What was the name the Romans gave to Great Britain?,Roma,Britannia,Britanica,Albion,2,3,,system,
What is the capital city of Slovenia?,Sarajevo,Ljubljana,Yaounde,Reykjavik,2,1,,system,
Which of these quotes is from the film 'The Departed'?,"""I’m the guy who does his job. You must be the other guy.""","""I'm gonna make him an offer he can't refuse.""","""I am big! It's the pictures that got small.""","""You motorboatin’ son of a b****!""",1,4,,system,
Chia seeds originated in which continent?,North America,Asia,Africa,Europe,1,3,,system,
"A ""sirocco"" refers to a type of __________.""",Boat,Wind,Horse,Tree,2,2,,system,
Which of these quotes is from the film 'Terminator 2: Judgment Day'?,"""Hasta la vista, baby.""","""Attica! Attica!""","""With great power comes great responsiblity.""","""Made it, Ma! Top of the world!""",1,4,,system,
Which sport is played at The Super Bowl?,American Football,Cycling,Tennis,Horse Racing,1,3,,system,
Which is the largest mountain range in India?,Himalayas,Satpura,Aravalli,Vindhyas,1,1,,system,
What are the first and last letters of the Greek alphabet?,Delta & Epsilon,Sigma & Tau,Alpha & Omega,Beta & Gamma,3,3,,system,
What is the name of the mythical bird that dies in a fire and is reborn from its own ashes?,The Phoenix,The Harpy,The Roc,The Siren,1,3,,system,
"Who was the 2nd president of the USA, in term during the period 1797–1801?",Ulysses S. Grant,John Adams,Herbert Hoover,Calvin Coolidge,2,3,,system,
What is the capital city of Thailand?,Bangkok,Phnom Penh,Suva,Windhoek,1,1,,system,
Which of these cheeses has a blue-green vein?,Gouda,Gorgonzola,Mozzarella,Provolone,2,3,,system,
"Who is associated with the address 221B Baker Street, London?",Sherlock Holmes,Harry Potter,Thomas Hardy,Charles Dickens,1,4,,system,
Which is the outermost planet in the Solar System?,Saturn,Jupiter,Neptune,Uranus,3,2,,system,
Which author wrote 'Manon Lescaut'?,Émile Zola,Alphonse Daudet,Alexandre Dumas,Antoine François Prévost,4,4,,system,
Acetylsalicylic acid is more commonly known as what?,Aspirin,Lemon Juice,Wine,Stomach Bile,1,2,,system,
What is the capital city of Republic of the Congo?,Yaren District,N'Djamena,Brazzaville,Tirana,3,1,,system,
"Which children's TV character has friends called Muck, Lofty, and Scoop?",Thomas the Tank Engine,Spongebob Squarepants,Bob the Builder,Scooby-Doo,3,4,,system,
What is dendrochronology the study of?,Venereal diseases,Minerals,The records in tree rings,Muscles,3,2,,system,
What type of food can be prepared 'Newberg style'?,Egg,Lobster,Tomato,Ham,2,3,,system,
Which of these is an American Football team based in Cincinnati?,Cincinnati Mariners,Cincinnati FC,Cincinnati Bengals,Cincinnati Cavaliers,3,3,,system,
"Which Republic, which later turned full-blown empire, gained dominance over Italy around 274 B.C.?",The Greek Empire,The Ottoman Empire,The Roman Empire,The Byzantine Empire,3,3,,system,
Which of these countries borders Yemen?,Eritrea,Saudi Arabia,Djibouti,Somalia,2,1,,system,
What war was the USA involved in between 1950 and 1953?,Vietnam War,World War II,Korean War,World War I,3,3,,system,
Which film contains the character 'Marge Gunderson'?,Taxi Driver,Network,Fargo,It's A Wonderful Life,3,4,,system,
Which actress has starred in both Walk the Line and Cruel Intentions?,Reese Witherspoon,Penélope Cruz,Kristin Scott Thomas,Naomi Watts,1,4,,system,
Who Was The First Woman To Fly Solo Across The Atlantic Ocean? ,Mary Johnson,Beryl Markham,Elise Du Pont,Amelia Earhart ,4,3,,system,
"In the Marvel Cinematic Universe, which character is played by Gwyneth Paltrow?",Wanda Maximoff,Pepper Potts,Valkyrie,Eitri,2,4,,system,
"Which artist first recorded 'Louie Louie', which was later covered by The Kingsmen?",Rockin' Robin Roberts and the Wailers,Nine Inch Nails,Nirvana,Creedence Clearwater Revival,1,4,,system,
Which word is defined as 'a commotion'?,Gardyloo,Cattywampus,Cattywampus,Hullaballoo,4,3,,system,
Which fish is smoked and cured and called 'finnan'?,Herring,Tuna,Salmon,Haddock ,4,3,,system,
Pottos and tarsiers are closely related to what small primates from Madagascar?,Lemurs,Gibbons,Tarsiers,Bushbabies,1,2,,system,
December 26th is traditionally known as Boxing Day but it is also which Saint's Holy Day,Saint Stephen,Saint Benedict,Saint Paul,Saint Francis,1,3,,system,
Which alternative rock band from the United States released the studio album 'Pinkerton'?,Weezer,The Black Keys,LMFAO,Static-X,1,4,,system,
What is the word for a female fox?,A Vixen,A Hen,A Doe,A Ewe,1,2,,system,
What does the singer Sting suggest you should do if you love somebody?,Set them free,Never let them go,Put a ring on them,Hold them tight,1,4,,system,
Which author wrote 'The Godfather'?,Dan Brown,Mario Puzo,Edgar Allan Poe,Stephen King,2,4,,system,
"What is the Latin term for ""the arm""?",Pedis,Oculus,Bracchium,Caput,3,3,,system,
Which city lies on the east side of San Francisco Bay?,Oakland,Los Angeles,"Washington, D.C.",Philadelphia,1,1,,system,
Which brand is associated with the marketing slogan 'Just do it'?,Puma,Reebok,Nike,Adidas,3,3,,system,
Where in the world would you most expect to be served Paella?,Denmark,Spain,Costa Rica,Cambodia,2,3,,system,
Where would you find the city of Helsinki?,Italy,Portugal,Spain,Finland,4,1,,system,
Which singer released the song 'Rude Boy'?,Drake,Rihanna,Ricky Martin,Nicki Minaj,2,4,,system,
Which book contains the character 'Celie'?,My Life As a Man,To Kill A Mockingbird,The Color Purple,The Metamorphosis,3,4,,system,
What is Will Smith's Rapper Alter Ego?,The Fresh Prince,Eminem,Jay Z,DJ Jazzy Jeff,1,4,,system,
Who invented the hot air balloon in the 18th century?,The Wright Brothers,The Vespucci Brothers,The Montgolfier Brothers,The Orville Brothers,3,3,,system,
Which fruit is used to make Calvados?,Cherries,Bananas,Limes,Apples ,4,3,,system,
Who developed the theory of universal gravitation?,Galileo Galilei,Albert Einstein,Charles Darwin,Isaac Newton,4,2,,system,
Which singer-songwriter's lyrics include 'People talking without speaking...people writing songs that voices never share'?,Bob Dylan,Paul Simon,Joni Mitchell,Leonard Cohen,2,4,,system,
How does a scout bee communicate to other bees about the location of flowers?,Whistling,Singing,Dancing,Buzzing,3,2,,system,
What is the word for a group of herrings?,A kindle,A murder,A host,A shoal,4,2,,system,
"Nicknamed the Godfather Of Soul, who died on Christmas Day 2006?",Marvin Gaye,Stevie Wonder,Ray Charles,James Brown,4,4,,system,
What is the word for a group of goats?,A herd,A muster,A watch,A murder,1,2,,system,
Which car manufacturer makes the Mustang?,Austin,BMW,Ford,Alfa Romeo,3,3,,system,
Which of these words relates to a family of dialects descended from the Ancient Egyptian language?,Coptic,Pernial,Maurovingian,Arabic,1,3,,system,
"Which physicist caused a stir in 2014 when he retracted his 1974 theory about black holes, stating that light may be able to escape them after all?",Issac Newton,Richard Feynman,Albert Einstein,Stephen Hawking,4,2,,system,
"What is the largest of the Mariana Islands, a U.S. territory located in the western Pacific Ocean?",Republic of Palau,Saipan,Puerto Rico,Guam,4,1,,system,
Which of these brands has a penguin on its logo?,Qantas,Linux,Bacardi,Playboy,2,3,,system,
How many ribs do most humans have?,12,6,24,15,3,2,,system,
Which band did Barry Gibb form with his brothers?,Bee Gees,Dire Straits,Culture Club,Level 42,1,4,,system,
The language 'Polish' belongs to which language family?,Dravidian,Sino-Tibetan,Indo-European,Turkic,3,3,,system,
Who won the 2005 Academy Award for Best Leading Actress for playing the role of June Carter in Walk the Line?,Keira Knightley,Felicity Huffman,Reese Witherspoon,Judi Dench,3,4,,system,
Which director directed The Hobbit: The Desolation of Smaug?,Peter Jackson,Woody Allen,Martin Scorsese,Steven Spielberg,1,4,,system,
From what kind of animal does rennet come from?,Cow,Sheep,Salmon,Chicken,1,3,,system,
What is the capital of Nebraska?,Omaha,Nebraska City,Lincoln,Kearney,3,1,,system,
What country used to sometimes be referred to by its Latin name of Helvetia?,Sweden,Austria,Norway,Switzerland,4,1,,system,
What Is An Allium Cepa?,Tomato,Onion,Potato,Garlic,2,2,,system,
"The __________ does not chew its food, but swallows it whole.",Kangaroo,Cow,Crocodile,Goliath Spider,3,2,,system,
What is the word for a group of ravens?,An unkindness,A run,A cete,A charm,1,2,,system,
"What 1922 F.W. Murnau film is detailed in the movie ""Shadow of the Vampire""?",Nosferatu,Dracula,Frankenstein,The Wolf Man,1,4,,system,
"Which American singer, songwriter, dancer and actress released the studio album 'Circus'?",Alanis Morissette,Madonna,Nicki Minaj,Britney Spears,4,4,,system,
Santiago is the capital city of which country?,Chile,Madagascar,Jamaica,Samoa,1,1,,system,
"Washington, D.C. is the capital city of which country?",Ireland,New Zealand,Australia,United States of America,4,1,,system,
"Double, double toil and trouble, Fire burn, and cauldron bubble. Comes from which of Shakespeare's plays?",King Lear,Hamlet,Macbeth,Romeo & Juliette,3,4,,system,
Which legendary mime picked up a 1955 Emmy for Best Specialty Act?,Charlie Chaplin,Marcel Marceau,Jacques Tati,Buster Keaton,2,4,,system,
Which director directed Alien?,Steven Spielberg,Martin Scorsese,Woody Allen,Ridley Scott,4,4,,system,
What is the state capital of Michigan?,Grand Rapids,Flint,Ann Arbor,Lansing,4,1,,system,
What is the term for a person from Bulgaria?,Bulgarite,Bulgarian,Bulgavite,Bulgarish,2,3,,system,
"""You're gonna need a bigger boat"" is a line from which 70's film?",The Godfather,Jaws,Star Wars,Titanic,2,4,,system,
Which of these is a hockey team based in Calgary?,Calgary Bears,Calgary Thunder,Calgary Flames,Calgary Royals,3,3,,system,
"Which influential historical person was  
a scholar who raised concern over growing population?",Thomas Malthus,Alexander Fleming,Michelangelo,Gregory Pincus,1,3,,system,
Who was the first European to sight New Zealand in 1642?,Christopher Columbus,Abel Tasman,John Cabot,James Cook,2,3,,system,
Chittagong is a city in which country?,Bangladesh,Singapore,Thailand,Malaysia,1,1,,system,
The language 'Nigerian Fulfulde' belongs to which language family?,Afroasiatic,Kra–Dai,Niger–Congo,Austroasiatic,3,3,,system,
Which of these is a competition in Horse Racing?,The Africa Cup of Nations,The World Cup Sevens,The Copa América,The Grand National,4,3,,system,
Who had a hit in 1968 with Harper Valley Pta?,Nena,Quiet Riot,Jeannie C. Riley,Michael Sembello,3,4,,system,
"If someone typed the letters 'ASL' in a message, what would they mean?",Any Souls Loggedin?,Awesome Situation Logged,Anybody Seen Lately?,Age Sex Location,4,3,,system,
The country of Dominica is on which continent?,South America,North America,Oceania,Europe,2,1,,system,
Which region of the world uses '.sd' at the end of its web addresses?,Sweden,Switzerland,Sudan,South Korea,3,1,,system,
"Who was the 43rd president of the USA, in term during the period 2001–2009?",George W. Bush,Franklin D. Roosevelt,Thomas Jefferson ,Gerald Ford,1,3,,system,
"What type of tree is known for its large, dark green leaves?",Elm Tree,Maple Tree,Oak Tree,Fir Tree,3,2,,system,
"Which country administers South Georgia, a last stop before Antarctica?",The UK,France,The USA,Argentina,1,1,,system,
What is the word for a painting technique using pigments mixed with egg yolk and water?,Watercolor,Pastel,Tempera,Dadaism,3,4,,system,
What is the Portuguese word for 'five'?,Cinco,Vijf,Oito,Fünf,1,3,,system,
Which English-Australian pop group released the song 'To Love Somebody'?,Culture Club,Dire Straits,Level 42,Bee Gees,4,4,,system,
The Black Forest region in Germany is famous for producing what type of clocks?,Cuckoo clocks,Grandfather clocks,Sundial clocks,Digital clocks,1,3,,system,
Bishkek is the capital city of which country?,Denmark,United Arab Emirates,Lithuania,Kyrgyzstan,4,1,,system,
What type of rock is formed when existing rocks are subjected to extreme heat and pressure?,Igneous Rocks,Metamorphic Rocks,Sedimentary Rocks,Fossils,2,2,,system,
Nur-Sultan is the capital city of which country?,Brunei,Iraq,Kazakhstan,Cabo Verde,3,1,,system,
What is the word for a racing sled?,Luge,Aski,Trok,Bobs,1,3,,system,
What is the most widely practiced religion in Russia?,Judaism,Orthodox Christianity,Islam,Catholicism,2,3,,system,
What Is The Oldest Continuously Inhabited City In The World,Beijing,Cairo,Rome,Damascus,4,1,,system,
Patricia Andrzejewski Is The Real Name Of Which Singer,Blondie,Patti Cake$,Patti Smith,Pat Benatar,4,4,,system,
Which word is defined as 'lacking enthusiasm or determination'?,Lackadaisical,Curmudgeon,Ratoon,Yarborough,1,3,,system,
"In which classic board game do players build roads, villages and cities to collect resources?",Settlers of Catan,Monopoly,Clue,Risk,1,3,,system,
Which author wrote 'Twice-Told Tales'?,Charles Dickens,Nathaniel Hawthorne,Henryk Sienkiewicz,Robert E. Howard,2,4,,system,
Which country fits snugly between the Tyrrhenian and Adriatic Seas?,Greece,Italy,Turkey,Spain,2,1,,system,
"What is the name of the character who utters the famous line 'To be, or not to be' in 'Hamlet'?",Ophelia,Laertes,Hamlet,Polonius,3,4,,system,
What was the name of the domestic videocassette tape recorder system introduced by Sony in 1975?,SuperMotion,Betamax,VHS,Videoman,2,3,,system,
Which Shakespeare title character is summoned by the Duke of Venice to help him deal with the threat of a Turkish attack?,Othello,Macbeth,Julius Caesar,Hamlet,1,4,,system,
"Made in France, what type of alcohol is Armagnac?",Gin,Brandy,Whiskey,Wine,2,3,,system,
Who won the 1998 Academy Award for Best Leading Actress for playing the role of Viola De Lesseps in Shakespeare in Love?,Gwyneth Paltrow,Fernanda Montenegro,Meryl Streep,Cate Blanchett,1,4,,system,
What is the name of the political philosophy that developed during the Renaissance?,Existentialism,Positivism,Materialism,Humanism,4,3,,system,
Which car manufacturer makes the Passat?,Aston Martin,Bugatti,Volkswagen,Audi,3,3,,system,
"Which American singer, songwriter, dancer and actress released the song '(You Drive Me) Crazy'?",Madonna,Nicki Minaj,Britney Spears,Alanis Morissette,3,4,,system,
"What is the fancy name for women's underwear, which is derived from a French word?",Intimates,Lingerie,Foundation garments,Corsetry,2,3,,system,
Which word is defined as 'coastal navigation; the exclusive right of a country to control the air traffic within its borders'?,Halfpace,Bumfuzzle,Dragoman,Cabotage,4,3,,system,
Which author wrote 'Adventures of Huckleberry Finn'?,Cassandra Clare,Isabel Allende,George R. R. Martin,Mark Twain,4,4,,system,
Which of these is a baseball team based in San Francisco?,San Francisco Oilers,San Francisco Kings,San Francisco Giants,San Francisco Fire,3,3,,system,
What celestial object was the first for humankind to set foot on?,The Moon,The Sun,Halley's Comet,Mars,1,2,,system,
In which continent would you find the Yellow river?,Asia,Africa,South America,North America,1,1,,system,
Who won the 1999 Academy Award for Best Supporting Actor for playing the role of Dr. Wilbur Larch in The Cider House Rules?,Michael Clarke Duncan,Jude Law,Tom Cruise,Michael Caine,4,4,,system,
"___________ was called the ""Gateway to the West"" in the 1800s because it served as a starting place for wagon train departures.",St. louis,"Washington, D.C.",New York City,Los Angeles,1,1,,system,
"What is the name of the natural wonder that stretches over 1,250 miles off the east coast of Australia?",The Northern Lights,The Mariana Trench,The Galapagos Islands,The Great Barrier Reef,4,1,,system,
"In the Bible, who was Adam's wife?",Sarah,Eve,Rachel,Miriam,2,3,,system,
Saint George's is the capital city of which country?,Barbados,Grenada,Mauritania,Ireland,2,1,,system,
From which European country did Mozambique declare independence in 1975?,Italy,Spain,France,Portugal,4,3,,system,
Which Northern UK English city Did The Beatles Come From?,Newcastle,Liverpool,Manchester,Leeds,2,4,,system,
Which film contains the character 'Tom Powers'?,The Silence of the Lambs,Rain Man,The Public Enemy,All About Eve,3,4,,system,
Which author wrote 'Jabberwocky'?,Charles Dickens,Lewis Carroll,Enid Blyton,George Orwell,2,4,,system,
Which band is Travis Barker the drummer for?,Nirvana,Green Day,Foo Fighters,Blink-182,4,4,,system,
Which does Carrie's mother warn her will happen if she attends the prom?,She would die,She would get dumped,She would be laughed at,She would get hurt,3,4,,system,
"A doctor who specializes in infants, children and young people is called a ______",Gynaecologist,Oncologist,Pediatrician,Physician,3,2,,system,
What is Sedimentology the study of?,bones,the study and treatment of diseases of the urogenital tract,a branch of geology that studies sediments,the eyes,3,2,,system,
Peter Jackson Is Responsible For Directing Which Famous Trilogy?,The Godfather,The Lord Of The Rings,The Matrix,Jurassic Park,2,3,,system,
Which American rock band released the album 'In Utero'?,Nirvana,Counting Crows,Three 6 Mafia,The Velvet Underground,1,4,,system,
Which T-Rex hit contains the line 'Take a black cat and sit it on your shoulder'?,Ride A White Swan,Get It On,Children of the Revolution,Cosmic Dancer,1,4,,system,
The Model 3 is a model of car made by which manufacturer?,Ford,Bugatti,Aston Martin,Tesla,4,3,,system,
Which type of restaurant popularized the use of conveyor belts?,Dessert,Sandwich,Pizza,Sushi,4,3,,system,
Which author wrote 'Tales from Shakspeare'?,Rainer Maria Rilke,Agatha Christie,Sebastian Brant,Charles and Mary Lamb,4,4,,system,
Which novel by Leo Tolstoy was published in separate parts from 1865 to 1869?,The Brothers Karamazov,War and Peace,Anna Karenina,Crime and Punishment,2,4,,system,
Which director directed Home Alone?,Martin Scorsese,Chris Columbus,Steven Spielberg,Woody Allen,2,4,,system,
Which word is used to describe early achievement in children?,Intelligent,Miraculous,Precocious,Prodigious,3,3,,system,
What colors are traditionally associated with the US Independence Day (4th of July)?,"Red, White, and Blue","Yellow, White, and Blue","Green, White, and Red","Red, White, and Yellow",1,3,,system,
"The painting ""Les Demoiselles d’Avignon"" by Pablo Picasso is a part of which art movement?",Pointilism,Surrealism,Abstract expressionism,Cubism,4,4,,system,
Which was the victorious side in the U.S. Civil War?,The North,The West,The East,The South,1,3,,system,
Which of these quotes is from the film 'The Jazz Singer'?,"""You had me at hello.""","""Gentlemen, you can't fight in here! This is the War Room!""","""I am a golden god!""","""Wait a minute, wait a minute. You ain't heard nothin' yet!""",4,4,,system,
Which 1776 American Affirmation Asserted The Basic Rights Of All?,The Declaration Of Independence,The Liberty Decree,The Emancipation Procalation,The Constitution,1,3,,system,
"The Khyber Pass, a strategic mountain pass, lies on the border of which two countries?",Brazil and Argentina,Pakistan and Afghanistan,Russia and China,Italy and Austria,2,1,,system,
What type of instrument is a triangle?,Percussion,Wind,String,Keyboard,1,4,,system,
Which author wrote 'Carmen'?,François-René de Chateaubriand,Prosper Mérimée,Maurice Leblanc,Charles Perrault,2,4,,system,
Which director directed The Terminator?,Woody Allen,Steven Spielberg,Martin Scorsese,James Cameron,4,4,,system,
Kinshasa is the capital city of which country?,Kyrgyzstan,Democratic Republic of the Congo,Kuwait,Turkmenistan,2,1,,system,
Which animal would you associate with the American Airlines logo?,Bull,Elephant,Bat,Eagle,4,3,,system,
What is the geological term meaning 'to wear away'?,Elevate,Erode,Emanate,Erupt,2,3,,system,
Which car manufacturer makes the Passat?,Volkswagen,Audi,Aston Martin,Bugatti,1,3,,system,
"In the Marvel Cinematic Universe, which character is played by Robert Downey Jr.?",The Grandmaster,Vision,Tony Stark,Alexander Pierce,3,4,,system,
Which US state is nicknamed the Garden State?,Hawaii,Oregon,Montana,New Jersey,4,1,,system,
Name the movie that matches the following plot summary: 'A destitute family builds a symbiotic relationship with a wealthy family.',Parasite,The Big Lebowski,Casino,Vertigo,1,4,,system,
What is Psychopathology the study of?,a synonym for taxonomy,the mental processes within mental illness or disorders,prehistoric climates,life in outer space,2,2,,system,
When did the Suez Crisis become a flashpoint in the Cold War?,1948,1940,1964,1956,4,3,,system,
What is the capital city of Papua New Guinea?,Bangui,Luanda,Paramaribo,Port Moresby,4,1,,system,
"Which actor has appeared in both ""Sons of Anarchy"" and ""Fantastic Beasts and Where to Find Them""?",John Turturro,Jean-Claude Van Damme,Seth Rogen,Ron Perlman,4,4,,system,
