question,option_1,option_2,option_3,option_4,correct_answer,category_id,display_date,created_by,updated_by
Which actor has starred in films including Men in Black and Enemy of the State?,Ralph Fiennes,Ryan Reynolds,Will Smith,Brian Cox,3,4,,system,
Which of these Latin phrases translates to 'Every beginning is difficult'?,Dies ad irae difficile,Actus me dificultus invito factus non est meus actus,Palma non sine pulvere dificultus,Omne initium difficile est,4,3,,system,
Which philosopher famously said 'The unexamined life is not worth living'?,Spinoza,Socrates,Ludwig Wittgenstein,Karl Marx,2,3,,system,
In which book series does 'Gilderoy Lockhart' appear?,Twilight,Voyages Extraordinaires,Harry Potter,Percy Jackson & the Olympians,3,4,,system,
"Which American rapper, producer and actor released the studio album 'The Marshall Mathers LP'?",Ludacris,Eminem,Drake,Nicki Minaj,2,4,,system,
What was the war between Argentina and Great Britan over?,Gold,Nuclear Weapons,Falkland Islands,Industrial Sabotage,3,3,,system,
Which of these fruits is not a tropical fruit?,Pineapple,Papaya,Apple,Mango,3,3,,system,
What is the word for a group of poultry?,A exaltation,A stud,A run,A parliament,3,2,,system,
Which actor plays the role of Gamora in the Marvel Cinematic Universe?,Zendaya,Brie Larson,Zoe Saldana,Angelina Jolie,3,4,,system,
With Which Particular Instrument Would You Associate Gerry Mulligan?,Saxophone,Violin,Piano,Drums,1,4,,system,
"Which director's films included Shivers, Videodrome and The Fly?",David Cronenberg,Alfred Hitchcock,Peter Jackson,Baz Luhrmann,1,4,,system,
What is the familiar expression for something that draws attention away from the main issue?,Yellow Squid,Blue Lobster,Red Herring,Green Shrimp,3,3,,system,
Which metal has the chemical element W?,Cobalt,Titanium,Tungsten,Nickel,3,2,,system,
Which author wrote 'The Tales of Beedle the Bard'?,Philip Pullman,Christopher Tolkien,C. S. Lewis,J. K. Rowling,4,4,,system,
What type of pasta is gemelli?,Stuffed pasta,Soup pasta,Shaped pasta,Strand pasta,3,3,,system,
What is the 1st book of the Hindu scripture?,Trig Veda,Big Veda,Rig Veda,Gig Veda,3,3,,system,
Which Pacific Nation Gained Independence From New Zealand In 1962,Western Samoa ,Fiji,New Caledonia,Japan,1,3,,system,
What was Marilyn Monroe's last film?,The Misfits,The Pariahs,The Outcasts,The Freaks,1,4,,system,
"Name the movie that matches the following plot summary: 'An aspiring musician enters the Land of the Dead to find his great-great-grandfather, a legendary singer.'",Coco,Gone Girl,The Usual Suspects,Aliens,1,4,,system,
Name the movie that matches the following plot summary: 'An angel is sent to help a man by showing him what life would have been like if he had never existed.',Ratatouille,Psycho,It's a Wonderful Life,WALL·E,3,4,,system,
Which lost city can you see while hiking the Inca trail from Cuzco?,Petra,Angkor Wat,Chichen Itza,Machu Picchu,4,1,,system,
In which country did the 'Bay of Pigs' invasion take place?,France,Cuba,China,Israel,2,3,,system,
"Who wrote the book ""Life So Far"", which includes how she wrote ""The Feminine Mystique""?",Margaret Atwood,Betty Friedan,Gloria Steinem,Maya Angelou,2,4,,system,
What city was destroyed by a 'little boy'?,Jericho,Babel,Dresden,Hiroshima,4,3,,system,
What is the meaning of the Latin phrase 'Necessitas etiam timidos fortes facit'?,Necessity breeds strength,"I came, I saw, I conquered","Out of chaos, comes order",Need makes even the timid brave,4,3,,system,
"In which city was Marie Laveau, the famous 19th century voodoo practitioner, based?",New Orleans,Havana,Kingston,Port-au-Prince,1,3,,system,
What is the lowest pitched stringed instrument?,Violin,Double Bass,Viola,Cello,2,4,,system,
"What is the name of the religious group with the print magazine ""The Watchtower""?",the Catholics,the Methodists,the Jehovah's Witnesses,the Mormons,3,3,,system,
Which nursery rhyme was the first gramophone recording?,Mary Had A Little Lamb,Three Blind Mice,Twinkle Twinkle Little Star,Humpty Dumpty,1,3,,system,
"Whiskey, hot coffee, and whipped cream make up which type of drink",Espresso Martini,Black Russian,Irish Coffee ,Black Velvet,3,3,,system,
Guess The Band From These Initials MO / HD / RW / JO / GB,Talk Talk,Bring Me the Horizon,Take That,Feeder,3,4,,system,
What is the term for the part of a financial portfolio that can be turned into cash quickly?,Leverage,Liquid assets,Diverse holdings,Private equity,2,3,,system,
"What is the Spanish word for ""hut""?",Ventana,Puerta,Casa,Cabana,4,3,,system,
What is a baby hawk known as?,An Eyas,A Poult,A Calf,A Nymph,1,2,,system,
Which of these cities is in Kazakhstan?,Zaporozhye,Karachi,Kharkov,Almaty,4,1,,system,
Which author wrote 'Pippi Longstocking'?,Charles Perrault,Beatrix Potter,Astrid Lindgren,Enid Blyton,3,4,,system,
In which book does 'Marmee March' appear?,David Copperfield,Jane Eyre,Buddenbrooks,Little Women,4,4,,system,
Which author wrote 'Lying Under the Apple Tree'?,Alphonse Daudet,Alice Munro,Ivan Turgenev,E. T. A. Hoffmann,2,4,,system,
Which actor played the role of George Bailey in It's A Wonderful Life?,Peter Finch,Anthony Hopkins,Peter Lorre,James Stewart,4,4,,system,
What was the name of the Empire founded by Osman I around 1300AD?,The Mughal Empire,The Seljuk Empire,The Safavid Empire,The Ottoman Empire,4,3,,system,
Which author wrote 'The Princess Diaries'?,Brandon Sanderson,Stephenie Meyer,Meg Cabot,Philip K. Dick,3,4,,system,
Which band includes 'will.i.am'?,Three 6 Mafia,MercyMe,The Velvet Underground,Black Eyed Peas,4,4,,system,
Which author wrote 'Starship Troopers'?,George R. R. Martin,Edgar Rice Burroughs,Jack Vance,Robert A. Heinlein,4,4,,system,
Which author wrote 'Purgatorio'?,Dante Alighieri,Aleksandr Solzhenitsyn,Agatha Christie,Giovanni Boccaccio,1,4,,system,
Which of these dishes would you most expect to find in Georgia?,Moussaka,Khachapuri,Nasi Lemak,Ropa Vieja,2,3,,system,
Who was the first female prime minister of India?,Gauri Khan,Indira Gandhi,Sarojini Naidu,Ratan Tata,2,3,,system,
In which book does 'Charles Stewart Parnell' appear?,Jane Eyre,Little Women,A Portrait of the Artist as a Young Man,David Copperfield,3,4,,system,
"On April 19, 1956, Grace Kelly had a storybook wedding with Prince Rainier of which country?",Monaco,Sweden,Switzerland,Andorra,1,3,,system,
What Kind Of Animal Is A Marmoset?,A Marsupial,A Rodent,A Bird,A Monkey,4,2,,system,
Which actor played the role of Alan Swann in My Favorite Year?,Anthony Hopkins,John Cusack,Peter O'Toole,Robert Mitchum,3,4,,system,
What is the name of the classic board game where players must be the first to send all four of their pieces all the way round a board?,Life,Trouble,Checkers,Risk,2,3,,system,
Which Spirit Is Pimm's No 1 Based On?,Whiskey,Gin ,Vodka,Rum,2,3,,system,
Which singer released Driving Home for Christmas in 1988?,David Duschamps,Kevin Dober,Chris Rea,Brian Jelico,3,4,,system,
Which country does one associate 'Dum Aloo'?,Jamaica,The USA,India ,France,3,3,,system,
How does that Latin phrase 'Pax vobiscum' translate into English?,"And you, Brutus",Peace be with you,Nothing is arduous for the willing,In good faith,2,3,,system,
Which school of painting focused on transitory visual impressions with an emphasis on the changing effects of light and color?,Impressionism,Surrealism,Romanticism,Cubism,1,4,,system,
"Fandible, lateral line, and dorsal fin are parts of a what?",Fish,Hurricane,Fighter jet,Mountain range,1,2,,system,
Which word is used to refer to a soccer match that is not part of an official competition?,Derby,Washer,Friendly,Double header,3,3,,system,
Which singer released the studio album 'Talk That Talk'?,Ricky Martin,Rihanna,Drake,Nicki Minaj,2,4,,system,
What is the plot of the movie Dr. Strangelove or: How I Learned to Stop Worrying and Love the Bomb?,24 hours in the lives of three young men the day after a violent riot.,A noble family becomes embroiled in a war for control over the galaxy's most valuable asset.,A naive youth leader is appointed to fill a vacancy in the U.S. Senate.,An insane American general orders a bombing attack on the Soviet Union.,4,4,,system,
What is Hepatology the study of?,The moon,Religion,The number 7,The liver,4,2,,system,
Which band includes 'Phil Collins'?,Genesis,Soft Machine,The Human League,Orchestral Manoeuvres in the Dark,1,4,,system,
"In the biblical story of Exodus, who tells Moses 'I know not the Lord, neither will I let Israel go'?",Pharaoh,Caesar Augustus,King Herod,Pontius Pilate,1,3,,system,
What sport would you associate with The Copa Libertadores?,American Football,Sailing,Horse Racing,Soccer,4,3,,system,
A male shark is known as what?,A Hob,A Tiercel,A Dog,A Bull,4,2,,system,
What two US states are rectangular?,Texas and Illinois,Maine and Nevada,Florida and Georgia,Colorado and Wyoming,4,1,,system,
Palikir is the capital city of which country?,Micronesia,Malawi,Israel,China,1,1,,system,
What is the capital city of Papua New Guinea?,Luanda,Bangui,Paramaribo,Port Moresby,4,1,,system,
Which director directed Apocalypse Now?,Woody Allen,Francis Ford Coppola,Steven Spielberg,Martin Scorsese,2,4,,system,
Who Was The 4th Wife Of Henry VIII?,Anne Of Cleeves,Anne Boleyn,Catherine Parr,Catherine of Aragon,1,3,,system,
Which author wrote 'Quidditch Through the Ages'?,J. K. Rowling,Christopher Tolkien,C. S. Lewis,Philip Pullman,1,4,,system,
Who won the 1979 Academy Award for Best Leading Actor for playing the role of Ted Kramer in Kramer vs. Kramer?,Jack Lemmon,Roy Scheider,Dustin Hoffman,Al Pacino,3,4,,system,
Which actor has featured in films including Ben-Hur and The Ten Commandments?,Gérard Depardieu,Charlton Heston,Dwayne Johnson,Shah Rukh Khan,2,4,,system,
Which of these is a baseball team based in Cleveland?,Cleveland Celtics,Cleveland Hornets,Cleveland Indians,Cleveland Blackhawks,3,3,,system,
What does LL Cool J.'s name stand for?,Ladies Love Cool James,Look Look Cool Jives,Little Lean Cool Jams,Live Laugh Cool Jokes,1,4,,system,
Which country invaded Tibet in 1950?,The USA,India,The USSR,China,4,3,,system,
What does the acronym 'OTOH' stand for in textspeak?,On The Other Hand,Only Truth Out Here,On Top Of Him,Out The Offensive Harm,1,3,,system,
How many slots with odd numbers does a standard roulette wheel have?,20,16,14,18,4,3,,system,
"In the bible, who says, ""I will now turn aside, and see this great sight, why the bush is not burnt""?",Goliath,King Herod,Moses,Jesus,3,3,,system,
What is the term for a business that has the exclusive right to supply a good or service in a given area?,Price Fixing,Price Discrimination,Oligopoly,Monopoly,4,3,,system,
"What U.S state is known as The Land of 10,000 Lakes?",Texas,Iowa,Florida,Minnesota,4,1,,system,
Which of these is a competition in Tennis?,The Presidents Cup,Le Mans 24 Hours,Wimbledon,The US PGA,3,3,,system,
Which film won the Academy Award for Best Picture in 1989?,Driving Miss Daisy,Born on the Fourth of July,Field of Dreams,Dead Poets Society,1,4,,system,
Which of these quotes is from the film 'Juno'?,"""I’m already pregnant. So, what other shenanigans could I get myself into?""","""You shall not pass!""","""This is Sparta!""","""Sawyer, you're going out a youngster, but you've t to come back a star!""",1,4,,system,
Which of the following describes Genghis Kahn?,Inventor of the printing press.,Engineer who helped develop radio transmission.,Political philosopher who promoted a theory of liberal democracy and a social contract.,Military and political leader of the Mongols.,4,3,,system,
Which American rhythm and blues vocal group released the song 'You've Really Got a Hold on Me'?,The Miracles,MercyMe,Three 6 Mafia,The Velvet Underground,1,4,,system,
Which of these is a hockey team based in Winnipeg?,Winnipeg Broncos,Winnipeg Penguins,Winnipeg Padres,Winnipeg Jets,4,3,,system,
Which of these countries borders Somalia?,Eritrea,Yemen,Seychelles,Kenya,4,1,,system,
Which actor played the role of Harry Lime in The Third Man?,James Stewart,John Belushi,Orson Welles,Humphrey Bogart,3,4,,system,
"For which man is the album 'At San Quentin, More of Old Golden Throat' named?",Elvis Presley,Johnny Cash,Roy Orbison,Buddy Holly,2,4,,system,
With which sport is Shane Warne associated?,Badminton,Cricket,Ice Hockey,Volleyball,2,3,,system,
Cheryl Lynn had a one hit wonder in 1979 with which song?,All My Life,Unbelievable,What I Am,Got to Be Real,4,4,,system,
Which of these is a major order of ancient architecture?,Athenian,Spartan,Doric,Roman,3,4,,system,
Which English rock band released the song 'Come Together'?,Uriah Heep,Feeder,Deep Purple,The Beatles,4,4,,system,
Which author wrote '1Q84'?,Oscar Wilde,Umberto Eco,Haruki Murakami,Søren Kierkegaard,3,4,,system,
Which book contains the character 'Florentino Ariza'?,Tinker,Love in the Time of Cholera,Portnoy's Complaint,Pale Fire,2,4,,system,
Which Is The Largest State In Australia,Western Australia ,Queensland,Victoria,Tasmania,1,1,,system,
Which of these colors would you find on the flag of Japan?,Yellow,Gold,Blue,Red,4,1,,system,
The country of Bhutan is on which continent?,Oceania,Europe,Asia,South America,3,1,,system,
What was the name of the B-29 used at Hiroshima to drop the bomb?,Lady Diamond,Big Boy,Dauntless,Enola Gay,4,3,,system,
Which people believe that Christ will return to Earth in the near future?,Samaritans,Assyrian Church,Anabaptists,Adventists,4,3,,system,
Funafuti is the capital city of which country?,Guatemala,Malawi,Togo,Tuvalu,4,1,,system,
"Which decade is known for literary works such as ""The Crucible"" and ""On the Road""?",The 1950s,The 1960s,The 1970s,The 1980s,1,4,,system,
"Which fruit has varieties called Concord, Niagra and Muscat?",Grapes ,Oranges,Apples,Peaches,1,3,,system,
In which country is cachaca a popular drink?,France,Brazil,Costa Rica,Italy,2,3,,system,
Which English rock band released the song 'Helter Skelter'?,The Clash,The Beatles,Queen,Oasis,2,4,,system,
What term of endearment is appropriate for your sister in Spanish?,Nina,Hermana,Familia,Amor,2,3,,system,
Which of these Latin phrases translates to 'Remember to live'?,Memento vivere,Pro bono,Palma non sine pulvere,Vincit qui patitur,1,3,,system,
What did Napoleon have built to commemorate his victories?,Arc de Triomphe,Notre Dame Cathedral,The Eiffel Tower,Le Louvre,1,3,,system,
In which country would you find the Statue of Liberty?,The UK,Spain,USA,Brazil,3,1,,system,
Which piece of written work starts with the line 'Aragorn sped on up the hill.'?,"Life, the Universe and Everything",The Mysterious Island,The Two Towers,A Connecticut Yankee in King Arthur's Court,3,4,,system,
Which wine god's orgiastic worship was suppressed by the Roman Senate in the 180s BC?,Bacchus,Hermes,Apollo,Zeus,1,3,,system,
What song did Dexy's Midnight Runners have a hit with in 1983?,Come on Eileen,Heart And Soul,Turning Japanese,96 Tears,1,4,,system,
In which century did Rembrandt live?,The 19th century,The 18th century,The 17th century,The 16th century,3,3,,system,
Which word is defined as 'nonsense'?,Poppycock,Quomodocunquizing,Ragamuffin,Dipthong,1,3,,system,
Which band includes 'Paul Simon'?,The Velvet Underground,MercyMe,Simon & Garfunkel,Three 6 Mafia,3,4,,system,
What vegetable is known a zucchini in the USA?,Cucumber,Onion,Courgette ,Carrot,3,3,,system,
What Road Safety Device Was Invented By Percy Shaw In 1943? ,Airbag,Traffic Light,Crumple Zone,Cats Eye,4,2,,system,
Which actor has played roles in films including Milk and Mystic River?,Pierce Brosnan,Colin Firth,Sean Penn,Javier Bardem,3,4,,system,
Which author wrote 'Poems in Prose'?,Henryk Sienkiewicz,Ivan Turgenev,Alphonse Daudet,Leo Tolstoy,2,4,,system,
"After the fall of the iron curtain, Russian leader Mikhail Gorbachev introduced a period of restructuring known as what?",Khozraschyot,Apparatchik,Uskoreniye,Perestroika,4,3,,system,
What paper size measures 210 mm × 297 mm?,A5,A4,A3,A2,2,2,,system,
Which of these colors is included on the flag of Germany?,Maroon,White,Green,Red,4,1,,system,
How old was Alexander the Great when he died ?,32,22,42,52,1,3,,system,
Which zodiac sign is characterized by a 2-sided personality and frequent mood changes?,Cancer,Sagittarius,Gemini,Virgo,3,3,,system,
What is Sitiology the study of?,"in ethics, duty",fossils of ancient life,dietetics,intonation in speech,3,2,,system,
Who of these is not a famous Indian person?,Mahatma Gandhi,Jawaharlal Nehru,Aref Qazvini,Indira Gandhi,3,3,,system,
Which of these quotes is from the film 'Scarface'?,"""Say hello to my little friend!""","""I’m the guy who does his job. You must be the other guy.""","""Snap out of it!""","""Tell 'em to go out there with all they got and win just one for the Gipper.""",1,4,,system,
What is the national animal of India?,Elephant,Crocodile,Lion,Tiger,4,3,,system,
What is Formicology the study of?,Algae,Ants,Water,Wine,2,2,,system,
A male bird is known as what?,A Rooster,A Cob,A Cock,A Ram,3,2,,system,
Which of these is a soccer team based in Orlando?,Orlando Eathquakes,Orlando Kings,Orlando City,Orlando Royals,3,3,,system,
With which sport is Jose Mourinho associated?,Baseball,Table tennis,Football,Ice Hockey,3,3,,system,
"On internet chats, what do the letters 'OC' mean?",Of Course,Original Content,Outclassed,On Chair,2,3,,system,
The Pantheon in Rome is an example of what style of architecture?,Classical,Baroque,Modernist,Gothic,1,1,,system,
What is the nickname of the English football team Cardiff City?,Cottagers,The Bluebirds,Wolves,The Tykes,2,3,,system,
"Which influential historical person was leader of 
the  Parliamentarians in the English civil war?",Gregor Mendel,Oliver Cromwell,Martin Luther,Francis Bacon,2,3,,system,
"If someone typed the letters 'TTYL' in a message, what would they mean?",Talk to you later,Try to yeet loads,Top thanks you legend,The two year lapse,1,3,,system,
What is the name of the cycle in a washing machine that dries clothes?,The shake,The tumble,The toss,The spin,4,3,,system,
"Which pioneering pop-media theorist, born in Edmonton, Alberta, coined the phrase 'The medium is the message'?",Glenn Greenwald,Marshall McLuhan,Noam Chomsky,Edward Snowden,2,3,,system,
"In Spanish, what is the meaning of the word 'siete'?",Yellow,White,Black,Seven,4,3,,system,
Who was the leader of Nazi Germany during World War II?,Winston Churchill,Adolf Hitler,Joseph Stalin,Benito Mussolini,2,3,,system,
What is a baby seal known as?,A Pup,A Calf,A Cygnet,A Caterpillar,1,2,,system,
Which American rhythm and blues vocal group released the song 'You've Really Got a Hold on Me'?,The Velvet Underground,Three 6 Mafia,The Miracles,MercyMe,3,4,,system,
"Which game  involves a patient called Cavity Sam, from whom players must remove objects using a pair of tweezers?",Surgery,Operation,Trauma Center,ER,2,3,,system,
Transformers are ___________ in disguise. ,Robots,Gods,Aliens,Wizards,1,3,,system,
Which book contains the character 'Geoffrey Firmin'?,Pale Fire,Under the Volcano,Blood Meridian,Nine Stories,2,4,,system,
Which British recording artist released the album 'Hounds of Love'?,John Lennon,Kate Bush,George Michael,David Bowie,2,4,,system,
From what food do you get copra?,Coconut,Pumpkin,Chilli,Banana,1,3,,system,
What is the name of the Hindu god of creation?,Brihaspati,Brahma,Krishna,Vishnu,2,3,,system,
What sport would you associate with The Copa Libertadores?,Soccer,Sailing,American Football,Horse Racing,1,3,,system,
"Stephen King's: ""Salem's _________"".",Boys,Witches,Lot,Game,3,4,,system,
What adjective is attached to both Gustave Pasch's match and Walter Hunt's pin?,Sharp,Smooth,Bright,Safety,4,2,,system,
Where in the world are avocados originally from?,South America,India,Southeast Asia,Europe,1,3,,system,
What is Craniology the study of?,Mythological beings,The characteristics of the skull,Angels and Demons,Large machinery,2,2,,system,
What Nationality Was The Chemist Alfred Nobe?l,American,French,English,Swedish ,4,2,,system,
"What is the name of the fashion trend popularized in the 1950s that involves wearing cardigans, loafers, and pleated skirts?",Grunge,Hippie,Gothic,Preppy,4,3,,system,
"The world's first leaning skyscrapers, Puerto de Europa, can be found in which country?",Portugal,France,Mexico,Spain,4,1,,system,
Where in the world are radishes originally from?,The Middle East,Central Asia,Southeast Asia,South America,1,3,,system,
"Which American singer, songwriter, and actress released the song 'Alejandro'?",Lady Gaga,Hikaru Utada,Madonna,Drake,1,4,,system,
From which language does the word 'ransack' come from?,Greek,Arabic,Norse,Latin,3,3,,system,
Which of these is a baseball team based in San Diego?,San Diego Padres,San Diego Celtics,San Diego Bears,San Diego Eagles,1,3,,system,
Which of these cities is in Romania?,Timisoara,Paris,Prague,Amsterdam,1,1,,system,
In which year was Citizen Kane released?,1917,1933,1941,1925,3,4,,system,
"Which song begins with the lyrics: ""Early in the morning, risin' to the street / Light me up that cigarette, and I'll strap shoes on my feet...""?","""Fergalicious"" by Fergie and will.i.am.","""What I Got"" by Sublime","""Rapper's Delight"" by Sugarhill Gang","""In da Club"" by 50 Cent",2,4,,system,
"Which American singer, songwriter, and actress released the song 'G.U.Y.'?",Madonna,Lady Gaga,Drake,Hikaru Utada,2,4,,system,
Where would you find the city of Minsk?,Tajikistan,Ukraine,Belarus,Kyrgyzstan,3,1,,system,
Which of these medals is NOT awarded at the Olympic games?,Bronze,Gold,Silver,Copper,4,3,,system,
From what country did the U.S. buy the Virgin Islands?,Norway,Sweden,Denmark,Finland,3,3,,system,
Which Roman Gladiator Lead An Unsuccessful Revolt Against Rome?,Commodus,Maximus,Spartacus,Ithacus,3,3,,system,
"A 'Boomer"" Is The Male Of Which Animal?",Crocodile,Kangaroo,Cow,Squirrel,2,2,,system,
Name the movie that matches the following plot summary: 'A couple undergoes a medical procedure to have each other erased from their memories.',Eternal Sunshine of the Spotless Mind,The Usual Suspects,Beauty and the Beast,Pulp Fiction,1,4,,system,
Who won the 1979 Academy Award for Best Leading Actor for playing the role of Ted Kramer in Kramer vs. Kramer?,Roy Scheider,Jack Lemmon,Al Pacino,Dustin Hoffman,4,4,,system,
Which piece of written work starts with the line 'There was no possibility of taking a walk that day.'?,David Copperfield,Jane Eyre,The Lady of the Camellias,Little Women,2,4,,system,
"In 1902 this volcano erupted, killing 30,000",Vesuvias,Krakatoa,Pelee,Mt St Helen's,3,3,,system,
"Which artist painted ""The Last Supper""",‎Salvador Dalí,Sandro Botticelli,Leonardo da Vinci,Vincent van Gogh,3,4,,system,
The Wars of the Roses (1455-85) were fought between which two houses of England?,Tudor and Stuart,Stark and Lannister,Hapsberg and Victoria,York and Lancaster,4,3,,system,
Which American gangster was shot dead outside a Chicago cinema in July 1934?,Ronald Kray,Al Capone,John Dillenger,Vito Corleone,3,3,,system,
With which sport is David Beckham associated?,Surfing,Tennis,Football,Hockey,3,3,,system,
What passenger jet airliner flew faster than the speed of sound?,Boeing 747,Ilyushin Il-86,MiG,Concorde,4,3,,system,
"Which song begins with the lyrics: ""Ooga-chaka, Ooga-ooga / Ooga-chaka, Ooga-ooga...""?","""American Pie"" by Don McLean","""What I Got"" by Sublime","""Hooked on a Feeling"" by B.J. Thomas","""Immigrant Song"" by Led Zeppelin",3,4,,system,
What Is Sauerkraut?,Pickled Carrot,Spiced Sausage,Fermented Cabbage ,Mashed Swede,3,3,,system,
Which British alternative band takes its name from a character from To Kill a Mockingbird ?,Deep Purple,The Boo Radleys,Pink Floyd,The Smiths,2,4,,system,
In which country would you find Uluru?,Mexico,India,Australia,South Africa,3,1,,system,
Which author wrote 'Don Quixote'?,Victor Hugo,Alphonse Daudet,Miguel de Cervantes,Oscar Wilde,3,4,,system,
"In the biblical story of Exodus, who tells Moses 'I know not the Lord, neither will I let Israel go'?",Caesar Augustus,Pontius Pilate,King Herod,Pharaoh,4,3,,system,
In which country is Madras? ,Bhutan,India,Nepal,Bangladesh,2,1,,system,
Who piloted a plane across the Pacific Ocean from Hawaii to the American mainland in 1935?,Jacqueline Cochran,Bessie Coleman,Harriet Quimby,Amelia Earhart,4,3,,system,
What country was invaded by Iraq in 1990?,Turkey,Israel,Kuwait,Saudi Arabia,3,3,,system,
Sir Stamford Raffles founded which Asian nation?,Thailand,Myanmar,Taiwan,Singapore,4,3,,system,
"In Western cultures, what is the traditional gift for a 40th wedding anniversary?",Ruby,Sapphire,Diamond,Emerald,1,3,,system,
The pasta ditalini has what meaning in Italian?,Butterflies,Elbows,Small thimbles,Little ears,3,3,,system,
What is Fetology the study of?,Feet,The fetus,Fetishes,The future,2,2,,system,
What term refers to a condition of very small gravitational forces?,Zero gravity,Hypergravity,Microgravity,Minigravity,3,2,,system,
What is the name of the Mexican national holiday which celebrates Mexico's victory over France at the Battle of Puebla?,Día de la Independencia,Cinco de Mayo,Día de la Revolución,Día de los Muertos,2,3,,system,
What is the plot of the movie The Usual Suspects?,Explorers travel through a wormhole in space in an attempt to ensure humanity's survival.,The stepdaughter of a sadistic army officer escapes into an eerie fantasy world.,A withdrawn boy who communicates with spirits seeks the help of a child psychologist.,A sole survivor tells of the events leading up to a horrific gun battle on a boat.,4,4,,system,
Which film contains the character 'Freddy Krueger'?,Austin Powers: International Man of Mystery,Fast Times at Ridgemont High,Taxi Driver,A Nightmare on Elm Street,4,4,,system,
What is a barometer used to measure?,Room Temperature,Salt in sea water,Humidity,Atmospheric Pressure,4,3,,system,
