question,option_1,option_2,option_3,option_4,correct_answer,category_id,display_date,created_by,updated_by
How fast (mph) can a kangaroo hop?,Thirty,Twenty,Forty,Fifty,3,2,,system,
What type of instrument is a bongo?,Percussion,Woodwind,Stringed,Brass,1,4,,system,
In which year was Back to the Future first released in the cinema?,1980,1975,1985,1970,3,4,,system,
Who was the first Prime Minister of Great Britain?,William Pitt the Younger,Robert Walpole,Thomas Paine,William Pitt the Elder,2,3,,system,
What is the word for a group of cubs?,A flight,A barren,A litter,A bevy,3,2,,system,
What is the plot of the movie A Beautiful Mind?,"After a mathematician accepts secret work in cryptography, his life takes a turn for the nightmarish.",The final secretary for Adolf Hitler tells of the Nazi dictator's final days.,"POWs are forced to build a railway, not knowing that allies are planning to destroy it.",The son of a former boxer is trained by his father for a mixed martial arts tournament.,1,4,,system,
What is the term for an office established by one country inside another to support and protect its citizens and aid commerce?,A missionary,A consulate,A delegation,An embargo,2,3,,system,
In which US city is the Sears Tower?,Los Angeles,Houston,New York,Chicago,4,1,,system,
What common fungal infection is also known as tinea pedis and is highly contagious?,Athlete's foot,Yeast infection,Ringworm,Jock itch,1,2,,system,
What Would You Be Drinking If You Were Given Earl Grey?,Juice,Tea ,Beer,Wine,2,3,,system,
Which US president was once the police commissioner of New York City?,George Washington,Donald Trump,Teddy Roosevelt,Abraham Lincoln,3,3,,system,
Which motoring brand is associated with the marketing slogan 'The Ultimate Driving Machine'?,Porsche,BMW,Mercedez-Benz,Harley Davidson,2,3,,system,
What is the name of a French pastry known for its flaky layers of puff pastry and pastry cream filling?,Napoleon,Antoinette,Eclair,Charles de Gaulle,1,3,,system,
"The ""Zebra murders"" of 1973-74 took place in which US city?",New York City,San Francisco,Los Angeles,Chicago,2,3,,system,
"What Chinese dish is traditionally made of shredded pork stir-fried with eggs, bamboo shoots, other vegetables, and served in thin pancakes?",Kung Pao,Lo Mein,General Tso's Chicken,Moo Shoo,4,3,,system,
Which director directed The Godfather?,Woody Allen,Martin Scorsese,Francis Ford Coppola,Steven Spielberg,3,4,,system,
What did Temujin change his name to?,Xerxes,Timur,Genghis Khan,Augustus,3,3,,system,
Which Is The 2nd Largest Country In The World?,Canada ,Russia,The USA,China,1,1,,system,
In which book series does Lord Voldemort appear?,Voyages Extraordinaires,Harry Potter,Percy Jackson & the Olympians,Twilight,2,4,,system,
Who performed the theme song to the James Bond film Quantum of Solace?,Tina Turner,Sheryl Crow,Jack White and Alicia Keys,Lulu,3,4,,system,
The language 'Japanese' belongs to which language family?,Sino-Tibetan,Austroasiatic,Austronesian,Japonic,4,3,,system,
Which Record Breaking Video Game Character Made It's Debut in May 1980?,Sonic The Hedgehog,Mario,Pac-Man,Lara Croft,3,3,,system,
What is the plot of the movie The Big Lebowski?,"On a journey to find the cure for a curse, a boy finds himself in the middle of a war.",The son of a former boxer is trained by his father for a mixed martial arts tournament.,"After awakening from a coma, a former assassin wreaks vengeance on those who betrayed her.",A slacker seeks restitution for a rug ruined by debt collectors.,4,4,,system,
What is the chemical potassium hydrogen tartrate often used for?,"It is used in liquid fertilizers, potassium soaps and detergents.",It is commonly used as a condiment and food preservative.,It is used in baking to stabilize egg whites.,"It is used in thermometers, thermostats, barometers",3,2,,system,
What is the plot of the movie Seven?,The story an English officer who successfully united and led the Arab tribes during World War I.,Two detectives hunt a serial killer who uses the deadly sins as his motives.,Prisoners of war plan to escape from a German camp during World War II.,A human soldier is sent from 2029 to 1984 to stop an almost indestructible cyborg killing machine.,2,4,,system,
Which car manufacturer names its models after different types of supernatural ghost-like beings?,Aston Martin,Lamborghini,Rolls-Royce,Toyota,3,3,,system,
What is a 'Blenheim Orange'?,A type of pear,A type of apricot,A type of peach,A type of apple ,4,3,,system,
Name the movie that matches the following plot summary: 'In World War II a group of soldiers go behind enemy lines to rescue a paratrooper.',Platoon,The Deer Hunter,Saving Private Ryan,The Big Lebowski,3,4,,system,
Which of these quotes is from the film 'The 40-Year-Old Virgin'?,"""You know how I know that you’re gay?""","""Oh, no, it wasn't the airplanes. It was Beauty killed the Beast.""","""Today, I consider myself the luckiest man on the face of the earth.""","""Not my tempo.""",1,4,,system,
In which country would you find the Itsukushima Shinto Shrine?,Japan,Russia,Vietnam,France,1,1,,system,
In which year was Seven first released in the cinema?,1999,1991,1995,1987,3,4,,system,
Which book contains the character 'Celie'?,To Kill A Mockingbird,My Life As a Man,The Metamorphosis,The Color Purple,4,4,,system,
Which American rock band has hits including ‘My Pal Foot Foot’ and ‘Gimmie Dat Ding’,The Shaggs,Nirvana,Guns N Roses,The Kingsmen,1,4,,system,
"Who Had An 80's Hit With The Song 'Just The Two of Us,'? ",Michael Jackson,Luther Vandross,Marvin Gaye,Bill Withers,4,3,,system,
Which conflict of legend was ignited by Paris and Helen?,The Punic Wars,The Trojan War,The Napoleonic Wars,The Crusades,2,3,,system,
What is the word for a young rabbit?,A Tadpole,A Bunny,An Elver,A Farrow,2,2,,system,
What is the chemical sodium hypochlorite often used for?,It is used to manufacture dry wall.,"It is used for surface purification, bleaching, odour removal and water disinfection.","It is used as an ingredient in the production of glass, bricks, and ceramics.",It is used to relieve pain and inflammation.,2,2,,system,
Who was the father of Alexander the Great?,Philip of Macedon,Alexander the Old,Marc Anthony,Julius Caesar,1,3,,system,
What started in 1849 when gold was discovered at Sutter's Mill?,The Louisiana Purchase,The California Gold Rush,The Cuban Revolution,The American Civil War,2,3,,system,
Which of these cities is in France?,Amsterdam,Barcelona,Toulouse,Copenhagen,3,1,,system,
What country is the subject of the Shizuoka Shimbun and the Nikkan Ube Jiho newspapers?,Thailand,Japan,China,South Korea,2,3,,system,
Which Swedish pop group released the song 'Happy New Year'?,HammerFall,In Flames,Katatonia,ABBA,4,4,,system,
Which city used to be called Takase?,Yokohama,Kyoto,Ōsaka,Yamagata,4,1,,system,
"Blanche Ames, Lord Lambourne and Willis Williams are all varieties of _________",Banana,Grape,Apple ,Cherry,3,3,,system,
Which Pig Latin word is used to reject or cancel a statement?,Epay,Ixnay,Oopstay,Ocklay,2,3,,system,
"The ""canebrake"", ""timber"" and ""pygmy"" are types of what""",Pig,Coyote,Goose,Rattlesnake,4,2,,system,
Which of these languages would you find spoken in India?,Bengali,Swahili,Quechua,Portuguese,1,3,,system,
In which sport can we score a touchdown?,Golf,American Football,Tennis,Swimming,2,3,,system,
Where in the world would you most expect to be served Polenta?,Ghana,Italy,France,Ivory Coast,2,3,,system,
Which of these cities is in Czech Republic?,Oslo,Stockholm,Berlin,Prague,4,1,,system,
The Corvette is a model of car made by which manufacturer?,BMW,Aston Martin,Ford,Chevrolet,4,3,,system,
"Which African country's national anthem is called 'Wimbo Wa Taifa' in Swahili, meaning 'anthem of the nation'?",Senegal,Cameroon,Mali,Kenya,4,1,,system,
"Which famous landmark has a full scale replica in Nashville, Tennessee?",The Colosseum,The Great Wall,The Eiffel Tower,The Parthenon,4,1,,system,
Which author wrote 'Insomnia'?,Edgar Allan Poe,Jack Vance,H. P. Lovecraft,Stephen King,4,4,,system,
Which BBC Weather Man Famously Denied Reports Of A Possible Hurricane In 1987?,Michael Fish ,Harry Mortimer,Gordon Jones,Brian Daniels,1,3,,system,
Which of the following describes Adolf Hitler?,Roman Emperor who accepted the Christian religion.,Dictator of Nazi Germany.,One of the pioneers of Quantum mechanics,Physicist who discovered X-rays.,2,3,,system,
"Whose first collection of short stories entitled ""In Our Time"" was published in 1925?",Anthony Burgess,Joseph Conrad,Ernest Hemmingway,George Orwell,3,4,,system,
Which new communication technology was introduced in the 1830's and 1840's?,Fax Machine,Telephone,Telegraph,Radio,3,3,,system,
"What is the Spanish word for ""few""?",Mucho,Torro,Poco,Loco,3,3,,system,
Which Period Came Between The Triassic & Cretaceous Periods?,The Triambic Period,The Mezozoic Period,The Thoracic Period,The Jurassic Period,4,2,,system,
The language 'Urdu' belongs to which language family?,Niger–Congo,Austroasiatic,Sino-Tibetan,Indo-European,4,3,,system,
Who performed the theme song to the James Bond film Octopussy?,Madonna,Billie Eilish,Rita Coolidge,Louis Armstrong,3,4,,system,
Which of these is a percussion instrument?,Cornett,Clarinet,Tabourine,Fife,3,4,,system,
"Which military attack took place on Dec. 7, 1941?",The bombing of hiroshima,The Nazi invasion of France,Pearl Harbour,D Day,3,3,,system,
Which tennis player was famous for the 'You cannot be serious'' outburst?,Bjorn Borg,John McEnroe,Pete Sampras,Ivan Lendl,2,3,,system,
Which musician released the album 'Aladdin Sane'?,Eric Clapton,David Bowie,Mika,Madonna,2,4,,system,
Which city lies on the east side of San Francisco Bay?,Los Angeles,Philadelphia,Oakland,"Washington, D.C.",3,1,,system,
What was the first Elvis Presley single released?,Hound Dog,Blue Suede Shoes,Teddy Bear,"That's All Right, Mama",4,4,,system,
Who won the 1991 Academy Award for Best Leading Actor for playing the role of Dr. Hannibal Lecter in The Silence of the Lambs?,Nick Nolte,Warren Beatty,Anthony Hopkins,Robert De Niro,3,4,,system,
 What colour is creme de menthe?,Green,Yellow,Red,Blue,1,3,,system,
From what is mead made?,Lemon,Butter,Honey ,Almond,3,3,,system,
If A Sparkling Wine Is Labelled As 'Brut' How Will It Taste?,Light,Fruity,Dry ,Sweet,3,3,,system,
Baseball: The Baltimore ________.,Yankees,Jays,Ravens,Orioles,4,3,,system,
Which animal supposedly predicts whether there will be 6 more weeks of winter or an early spring?,A mole,An armadillo,A prairie dog,A groundhog,4,3,,system,
Which boy band included Nick Carter?,One Direction,Backstreet Boys,NSYNC,Boyzone,2,4,,system,
What is the term for fishing bait that is made from ground-up fish?,Bloaters,Jetsam,Flotsam,Chum,4,3,,system,
Which of the following describes Alexander the Great?,King of Macedonia and military leader.,Leader of the Russian Revolution and new Communist regime from 1917 to 1924.,French military and political leader.,Principal figure of Jainism.,1,3,,system,
Which of these quotes is from the film 'The Jazz Singer'?,"""You had me at hello.""","""Gentlemen, you can't fight in here! This is the War Room!""","""I am a golden god!""","""Wait a minute, wait a minute. You ain't heard nothin' yet!""",4,4,,system,
Which band includes 'Björn Ulvaeus' as one of its members?,HammerFall,ABBA,Katatonia,In Flames,2,4,,system,
What is Dermatology the study of?,Parasites,Birds,The Ancient Egyptians,The skin,4,2,,system,
"What Irish playwright and author, wrote ""The Importance of Being Ernest"" and ""A Picture of Dorian Grey"" among others?",Samuel Beckett,William Butler Yeats,Oscar Wilde,James Joyce,3,4,,system,
What is the meaning of the term 'bon mot'?,A quip,A type of hat,A food dish,A dance move,1,3,,system,
Ropa Vieja is a dish that is most associated with which part of the world?,Ivory Coast,Russia,Cuba,Italy,3,3,,system,
The fall of Constantinople in 1453 marked the end of which empire?,The Ottoman Empire,The Byzantine Empire,The Holy Roman Empire,The Mongol Empire,2,3,,system,
Which author wrote 'The Winter's Tale'?,Isaac Newton,Enid Blyton,Arthur C. Clarke,William Shakespeare,4,4,,system,
Which author wrote 'The Satanic Verses'?,Henry James,Vladimir Nabokov,Salman Rushdie,Brandon Sanderson,3,4,,system,
"In Greek mythology, what kind of monster is an offspring of a woman and a bull?",The centaur,The gorgon,The minotaur,The chimera,3,3,,system,
Which fish is able to breathe air?,Bubblefish,Airfish,Lungfish,Shark,3,2,,system,
The Petronas Towers are a pair of iconic skyscrapers located in what city?,Kuala Lumpur,Tokyo,Seoul,Singapore,1,1,,system,
Who wrote the children's book 'How The Grinch Stole Christmas'',Dr Seuss,J.K Rowling,Enid Blyton,Roald Dahl,1,4,,system,
What is the chemical calcium carbonate often used for?,It is used as a building material.,It is used in laundry detergent.,It is used to preserve food.,It is used to manufacture dry wall.,1,2,,system,
How Many Draughts Are On The Board At The Start Of A Game?,12,24,16,20,2,3,,system,
"What is the meaning of the name ""Israel"" in the Bible?",God is my judge,Who prevails with God,God strengthens,God is with us,2,3,,system,
'Connecting people' is a slogan associated with which technology brand?,Nokia,Verizon,Vodafone,Google,1,3,,system,
What is the chemical trinitrotoluene often used for?,"It is used in nuclear reactors, as a neutron moderator.",It is known to relieve pain and inflammation.,It is used in disinfectants and antiseptics.,"It is used in used in military shells, bombs, and grenades.",4,2,,system,
Which American rock band released the album 'Californication'?,Black Flag,Red Hot Chili Peppers,The Monkees,Journey,2,4,,system,
Who won the 2018 Academy Award for Best Leading Actress for playing the role of Queen Anne in The Favourite?,Olivia Colman,Lady Gaga,Glenn Close,Yalitza Aparicio,1,4,,system,
Which of the following describes St. Paul?,One of the main writers of the New Testament.,One of the main characters of the Protestant Reformation. ,The first pope.,Missionary responsibile for spreading Christianity to East Asia. ,1,3,,system,
Which of the 7 Ancient Wonders of the World was a giant depiction of the Greek sun god Helios?,The Temple of Artemis,The Great Pyramid of Giza,The Colossus of Rhodes,The Statue of Zeus,3,3,,system,
What is the name of the shoulder-held weapon used for firing armor-piercing rockets?,Bazooka,Grenade,Mortar,HIMARS,1,3,,system,
What is the capital city of Fiji?,Suva,Bandar Seri Begawan,Victoria,Dushanbe,1,1,,system,
What is the Spanish word for conqueror?,Conquistador,Atormentador,Esclavo,Babuino,1,3,,system,
Who piloted a plane across the Pacific Ocean from Hawaii to the American mainland in 1935?,Jacqueline Cochran,Amelia Earhart,Bessie Coleman,Harriet Quimby,2,3,,system,
In 1937 Chester Carlson invented a process called Xerography. What do we call it today?,Radiography,Deep fat frying,Lock picking,Photocopying,4,2,,system,
Jermaine Stewart had a one hit wonder in 1986 with which song?,I'Ve Never Been to Me,We Don't Have to Take Our Clothes Off,Unbelievable,Pop Muzik,2,4,,system,
Niamey is the capital city of which country?,Israel,Belize,Kyrgyzstan,Niger,4,1,,system,
"Which author wrote 'Blind Willow, Sleeping Woman'?",Søren Kierkegaard,Haruki Murakami,Umberto Eco,Oscar Wilde,2,4,,system,
Which American singer released the song 'Everytime'?,Alanis Morissette,Britney Spears,Nicki Minaj,Madonna,2,4,,system,
In which year was The Dark Knight first released in the cinema?,2008,2010,2006,2012,1,4,,system,
How many holes are there on a traditional paint pallette?,0,1,2,3,2,4,,system,
On which state border is the Hoover Dam? ,Arizona/Nevada,California/Nevada,Utah/Colorado,Utah/Nevada,1,1,,system,
"In 1942, from which Native American tribe did the US Military recruit 29 men from to develop a code that the Japanese never broke?",Sioux,Apache,Navajo,Cherokee,3,3,,system,
Which great Renaissance figure had the surname Buonarroti?,Donatello,Leonardo,Michelangelo,Raphael,3,4,,system,
What nursery rhyme includes a dish and a spoon running away together?,Humpty Dumpty,Hey Diddle Diddle,Baa Baa Black Sheep,Mary Had a Little Lamb,2,4,,system,
"Which American singer, songwriter, dancer and actress released the song '(You Drive Me) Crazy'?",Alanis Morissette,Madonna,Nicki Minaj,Britney Spears,4,4,,system,
What nationality did Adolf Hitler have until 1925?,Swiss,French,Austrian,German,3,3,,system,
"Generally speaking, on a restaurant menu, what might be presented in the style referred to as Macedoine?",Soup,Vegetables,Wine,Bread,2,3,,system,
Which actor played the role of Howard Beale in Network?,Malcolm McDowell,Peter Finch,Jaye Davidson,Jeff Bridges,2,4,,system,
"Which American singer, actress and record producer released the song 'Déjà Vu'?",Nicki Minaj,Madonna,Drake,Beyoncé,4,4,,system,
What is the meaning of the name of the constellation Corona Borealis?,Great Light,Dazzling Forest,Brave Hunter,Northern Crown,4,3,,system,
What is the atomic number for thalium?,14,81,12,26,2,2,,system,
Which Toyota model has a name that is Latin for 'first'?,Corolla,Yaris,Camry,Prius,4,3,,system,
"Corolla, filament and stigma are parts of a what?",Flower,Spider,Microchip,Star,1,2,,system,
From which part of the world does papaya originate?,The Middle East,Central America,Europe,South America,2,3,,system,
Which French electronica duo released the song 'One More Time'?,Gong,Nouvelle Vague,Indochine,Daft Punk,4,4,,system,
Who was the first king of Hungary?,St. Marko,St. Alexander,St. Cyril,St. Stephen,4,3,,system,
With which sport is Larisa Latynina associated?,Basketball,Football,Gymnastics,Rugby Union,3,3,,system,
Which film contains the character 'Jake Gittes'?,Chinatown,The Terminator,Ghost,Breakfast at Tiffany's,1,4,,system,
Which Boyband Released An Album Entitled “Walthamstow” In 1992?,East 17,Boyz II Men,New Kids on the Block,Take That,1,4,,system,
Which region of the world uses '.sn' at the end of its web addresses?,Senegal,Singapore,Bosnia and Herzegovina,Sudan,1,1,,system,
What is the name used for any half of the globe?,Pangaea,Hemisphere,Equator,Continent,2,1,,system,
What is Lithology the study of?,Rocks,Human movement,Light waves,Diseases of the lungs,1,2,,system,
Which group released the album 'The Visitors'?,The Beach Boys,The Police,Radiohead,ABBA,4,4,,system,
"When was ARPANET, the precursor to the Internet, first developed?",1978,1948,1969,1990,3,3,,system,
What date is St. Patrick's Day? ,February 16th,March 17th,February 15th,March 14th,2,3,,system,
Who played the role of James Bond in Live and Let Die?,Daniel Craig,Sean Connery,George Lazenby,Roger Moore,4,4,,system,
The country of Mauritius is on which continent?,Europe,Africa,South America,Oceania,2,1,,system,
What type of meat is used in the preparation of Osso Bucco?,Beef,Lamb,Veal ,Pork,3,3,,system,
Who played the role of James Bond in Quantum of Solace?,Timothy Dalton,Roger Moore,Pierce Brosnan,Daniel Craig,4,4,,system,
What is the capital city of South Korea?,Incheon,Seoul,Daegu,Busan,2,1,,system,
On what island is Pearl Harbour?,Kauai,Maui,Oahu,Hawaii,3,1,,system,
What Word Is Used To Describe Bell Shaped Flowers?,Cambarn,Clochical,Belieux,Campanulate,4,2,,system,
In Sabrina The Teenage Witch What Is The Name Of Sabrina's Cat?,Salem,Greensboro,Alexandria,Wilmington,1,4,,system,
What is the capital city of Pakistan?,Tallinn,Zagreb,Islamabad,Tehran,3,1,,system,
Which country reclaimed about 17% of its land from the sea by pumping out water and making new areas called polders?,Estonia,The Netherlands,Thailand,Bangladesh,2,1,,system,
"Which actor played the character Clubber Lang, the rival of Sylvester Stallone's character in Rocky III?",Hulk Hogan,Dolph Lundgren,Carl Weathers,Mr. T,4,4,,system,
In what year were the atomic bombs dropped on Hiroshima and Nagasaki?,1938,1948,1945,1941,3,3,,system,
What colour is wasabi?,Red,Blue,Purple,Green,4,3,,system,
What is the Spanish word for 'reddish-brown' that signifies a cigar class?,Colorado,Blanco,Verde,Negro,1,3,,system,
What is a skin specialist called?,Dermatologist,Skin Clinician,Visologist,Permologist,1,2,,system,
"In modern slang, what is the term for abruptly cutting off all communication, especially with a romantic partner?",Ghosting,Negging,Vanishing,Dropping,1,3,,system,
What name is given to the seaweed sheets used to wrap sushi rolls?,Mirin,Nori,Wasabi,Sake,2,3,,system,
What type of instrument is a clarinet?,Percussion,Woodwind,Brass,Stringed,2,4,,system,
Which English-Australian pop group released the studio album 'Odessa'?,Bee Gees,Culture Club,Level 42,Dire Straits,1,4,,system,
What is Paedology the study of?,Religion,Children's behavior and development,Male health and disease,The anatomy of the cardiovascular system,2,2,,system,
To where do Muslims make pilgrimage?,Dubai,Riyadh,Tehran,Mecca,4,3,,system,
"During which religious festival are Muslims forbidden to eat, drink or have sex between sunrise and sunset?",Yom Kippur,Uposatha,Eid al-Adha,Ramadan,4,3,,system,
What is the name of the Aztec capital city?,Tlatelolco,Tzintzuntzan,Tenochtitlan,Teotihuacan,3,3,,system,
"The Average Woman Has 9 Pints Of Blood, How Much Has The Average Man",9 Pints,12 Pints,10 Pints,7 Pints,2,3,,system,
"Who sang the 2009 hit 'One Time' with the lyrics 'Girl I love, girl I love you'?",Harry Styles,Justin Bieber,Ed Sheeran,Shawn Mendes,2,4,,system,
"Which American singer, songwriter, dancer and actress released the studio album 'Circus'?",Nicki Minaj,Britney Spears,Alanis Morissette,Madonna,2,4,,system,
Which singer-songwriter's lyrics include 'People talking without speaking...people writing songs that voices never share'?,Leonard Cohen,Joni Mitchell,Bob Dylan,Paul Simon,4,4,,system,
What is Etymology the study of?,Dust in the atmosphere and its effects,The skull,The age of trees,Word origins,4,2,,system,
" What is Japanese ""sake"" made from?",Rice,Corn,Potato,Fish,1,3,,system,
What Latin term is used to refer to the university that someone attended?,Magna Cum Laude,Curriculum Vitae,Alma Mater,Maxima Cum Laude,3,3,,system,
Which of the following is NOT an official language of Switzerland?,Spanish,French,German,Italian,1,3,,system,
"Which American singer, songwriter, dancer and actress released the studio album 'Femme Fatale'?",Britney Spears,Madonna,Alanis Morissette,Nicki Minaj,1,4,,system,
How many standard bottles of champagne are in a magnum?,Five,Three,Two ,Four,3,3,,system,
"Which Swedish pop group released the song 'Money, Money, Money'?",In Flames,ABBA,Katatonia,HammerFall,2,4,,system,
Which of these countries borders Papua New Guinea?,Federated States of Micronesia,Indonesia,Solomon Islands,Palau,2,1,,system,
"Which director of the film ""Moulin Rouge!"" brought his hit production of ""La boheme"" to Broadway in 2002?",Baz Luhrmann,Steven Spielberg,Darren Aronofsky,Christopher Nolan,1,4,,system,
Which American rock band released the studio album 'Mechanical Animals'?,Marilyn Manson,The Velvet Underground,MercyMe,Three 6 Mafia,1,4,,system,
Which author wrote 'The Satanic Verses'?,Brandon Sanderson,Henry James,Vladimir Nabokov,Salman Rushdie,4,4,,system,
Which country did Idi Amin invade in 1979?,Tanzania,Uganda,Kenya,Zambia,1,3,,system,
Yamoussoukro is the capital city of which country?,Cote d'Ivoire,Sudan,Australia,Hungary,1,1,,system,
Which author wrote 'Eclipse'?,Stephenie Meyer,Robert A. Heinlein,Brandon Sanderson,Jack Vance,1,4,,system,
Zagreb is the capital city of which country?,Greece,Pakistan,Belarus,Croatia,4,1,,system,
What is conchology the study of?,The Weather,Sex,Shells and molluscs,The origin and spread of diseases,3,2,,system,
Who was the youngest person ever elected president of the USA?,Theodore Roosevelt,John F. Kennedy,Barack Obama,Abraham Lincoln,2,3,,system,
When was COVID-19 declared a Global Pandemic?,2021,2020,2019,2018,2,3,,system,
What is the capital city of Bhutan?,Bamako,Mogadishu,Montevideo,Thimphu,4,1,,system,
"Who wrote ""The count of Monte-Christo""?",Victor Hugo,Jean Paul Sartre,Albert Camus,Alexandre Dumas,4,4,,system,
Which author wrote 'Solaris'?,Stanisław Lem,Philip K. Dick,Mikhail Bulgakov,Douglas Adams,1,4,,system,
The country of Cape Verde is on which continent?,Africa,Europe,Oceania,South America,1,1,,system,
"Which piece of written work starts with the line '3 May. Bistritz. - Left Munich at 8.35 p.m. on 1st May, arriving at Vienna early next Morning; should have arrived at 6.46, but train was an hour late.'?",World War Z,Carrie,Dracula,'Salem's Lot,3,4,,system,
Which actor played the role of Robin Hood in The Adventures of Robin Hood?,Robert Mitchum,Clint Eastwood,Errol Flynn,Sidney Poitier,3,4,,system,
In which country would you find the Giant's Causeway?,Greece,Northern Ireland,Vietnam,New Zealand,2,1,,system,
Which actor has starred in films including Suicide Squad and Men in Black?,Brian Cox,Ralph Fiennes,Will Smith,Ryan Reynolds,3,4,,system,
With which sport is Emil Zatopek associated?,Basketball,Badminton,Motor racing,Athletics,4,3,,system,
Which of the following is the main symptom of bronchitis?,Headache,Weight gain,Nausea,Cough,4,2,,system,
Nassau is the capital city of which country?,Bahamas,Vanuatu,Peru,Kiribati,1,1,,system,
"To the nearest mile, how many miles are in a marathon?",12,40,50,26,4,3,,system,
"Although the Poodle is widely associated with France, in which country is it believed to have originated?",India,Egypt,Spain,Germany,4,3,,system,
What is the capital city of Romania?,Bratislava,Vientiane,Bucharest,Sarajevo,3,1,,system,
Which of these quotes is from the film 'The Fast and the Furious'?,"""Hello, gorgeous.""","""Fasten your seatbelts. It's going to be a bumpy night.""","""I live my life a quarter mile at a time.""","""Release the Kraken!""",3,4,,system,
